Active (0/1);Name *;Categories (x,y,z...);Price with tax;Price without tax;Description;Quantity;Image URLs (x,y,z...)
1;Rainbow High, Gabriella Icely, lalka modowa;Lalki/Lalki celebrytki;119.99;98.35245901639344;"Legenda głosi, że na końcu tęczy znajduje się garnek złota. Ale prawda jest taka, że to coś jeszcze bardziej niesamowitego. Tylko nieliczni, którzy znają się na modzie, mogą podążać za tęczą do Rainbow High, kolorowej szkoły mody, w której każdy uczy się pokazywać swoje prawdziwe kolory. Przedstawiamy Gabriellę Icely. Jest ubrana ""w lód"" czyli na jasnoniebiesko od stóp do głów. Ma wspaniałe rysy twarzy, długie rzęsy i piękne włosy, które można rozczesać. Jest w pełni ruchoma, jej ręce i nogi zginają się, więc może przybrać mnóstwo efektownych poz. Gabriella ma oko do projektowania mody i uwielbia opracowywać tkaniny. Jej lodowaty niebieski wygląd jest świeży i piękny. Ubrana w dzianinowy sweter z golfem, metaliczną spódnicę z tęczowym paskiem i buty z wężowej skóry jest niezwykle stylowa. Jej drugi strój to holograficzna sukienka, kurtka ze skóry węża i wysokie szpilki z paskami. Zestaw zawiera również grzebień do włosów, dwa wieszaki i stojak na lalki. Rada:  Podczas pierwszego rozpakowywania lalki dokładnie umyj jej włosy, aby usunąć żel do stylizacji i pozwól włosom całkowicie wyschnąć. Następnie jej włosy są gotowe do wyszczotkowania. Zbierz kolekcję pięknych lalek z Rainbow High! Wysokość lalki:  ok. 28 cm.  ";500;https://img.smyk.com/https://beta-cdn.smyk.com/media/product/390/1/rainbow-high-gabriella-icely-lalka-modowa-7030595.jpg
1;Rainbow High, Skyler Bradshaw, lalka modowa;Lalki/Lalki celebrytki;139.99;114.74590163934428;Legenda głosi, że na końcu tęczy znajduje się garnek złota. Ale prawda jest taka, że to coś jeszcze bardziej niesamowitego. Tylko nieliczni, którzy znają się na modzie, mogą podążać za tęczą do Rainbow High, kolorowej szkoły mody, w której każdy uczy się pokazywać swoje prawdziwe kolory. Przedstawiamy Skyler Bradshaw. Jest ubrana na niebiesko od stóp do głów i ma wspaniałe rysy twarzy, długie rzęsy i piękne włosy, które można rozczesać. Jest w pełni ruchoma, jej ramiona i nogi zginają się, więc może przybrać mnóstwo efektownych poz. Skyler zawiera 2 kompletne stroje, które można łączyć i dopasowywać, aby uzyskać odważny, efektowny wygląd. Klasyczny styl z jeansem i odrobiną blasku lub jeansowy top i spódnicę, jeansową kurtkę, sukienkę, urocze skarpetki, szpilki i nie tylko. Zawiera również grzebień do włosów, dwa wieszaki i stojak na lalki. Rada:  Podczas pierwszego rozpakowywania lalki dokładnie umyj jej włosy, aby usunąć żel do stylizacji i pozwól włosom całkowicie wyschnąć. Następnie jej włosy są gotowe do wyszczotkowania. Zbierz kolekcję pięknych lalek z Rainbow High! Wysokość lalki:  ok. 28 cm.  ;500;https://img.smyk.com/https://beta-cdn.smyk.com/media/product/390/1/rainbow-high-skyler-bradshaw-lalka-modowa-6736228.jpg
1;Barbie, Przyczepa kempingowa Chelsea, zestaw z lalką i akcesoriami;Lalki/Lalki celebrytki;94.99;77.86065573770492;Dzięki zestawowi do zabawy Klub Chelsea z przyczepą kempingową i lalką dzieci mogą w każdej chwili wyruszyć ku przygodzie - zestaw przekształca się w obozowisko, a dołączone elementy do zabawy, w tym szczeniaczek, inspirują wyobraźnię! Przymocuj przyczepę do samochodu, umieść lalkę Chelsea w fotelu kierowcy i popchnij auto, aby ruszyć w drogę! Jeśli chcesz pojeździć samym kabrioletem lub rozbić obóz, wystarczy odłączyć przyczepę. Odczep haczyk i otwórz ją, aby odsłonić przytulne wnętrze! Dzięki elementom do zabawy możesz stworzyć odpowiedni klimat do śpiewania piosenek i snucia opowieści przy ognisku - ustaw palenisko, wyjmij 2 kijki z piankami i łap za gitarę. Łóżko piętrowe z drabinką zapewnia spokojny sen nawet w drodze. Kuchnia ma pełne wyposażenie:  zlew, kuchenkę, lodówkę z otwieranymi drzwiami, w której można schować dwa kubki znajdujące się w zestawie, ręcznik do zawieszenia przy blacie oraz garnuszek ze specjalnym zaczepem do przymocowania na palniku kuchenki. Są też drzwiczki dla psów, aby szczeniaczek mógł z łatwością wchodzić i wychodzić! Podczas krótkich wycieczek autem otwierany bagażnik pomieści walizkę i inne potrzebne rzeczy. Wiek dziecka:  od 3 lat.  ;500;https://img.smyk.com/https://beta-cdn.smyk.com/media/product/390/1/barbie-przyczepa-kempingowa-chelsea-zestaw-z-lalka-i-akcesoriami-6503680.jpg
1;Rainbow High, Fashion Doll, Mila Berrymore, lalka modowa;Lalki/Lalki celebrytki;99.99;81.95901639344262;Legenda głosi, że na końcu tęczy znajduje się garnek złota. Ale prawda jest taka, że to coś jeszcze bardziej niesamowitego. Tylko nieliczni, którzy znają się na modzie, mogą podążać za tęczą do Rainbow High, kolorowej szkoły mody, w której każdy uczy się pokazywać swoje prawdziwe kolory. W zestawie:  lalka Mila z długimi włosami do czesania akcesoria do włosów i grzebień dodatkowa odzież dla lalek (2 komplety) + wieszaki akcesoria modowe (kolczyki, torebka, buty...) stojak na lalkę Lalka zgina się w przegubach. Rozmiar:  30,48x 8,13x30,48 cm Zbierz kolekcję pięknych lalek z Rainbow High!  ;500;https://img.smyk.com/https://beta-cdn.smyk.com/media/product/390/1/rainbow-high-fashion-doll-mila-berrymore-lalka-modowa-7208078.png
1;L.O.L. Surprise, Tweens, Nia Regal, lalka modowa;Lalki/Lalki celebrytki;69.99;57.36885245901639;Przedstawiamy L.O.L. Surprise! Tweens! Te charakterne Be Tweens są dostępne z niespodziankami i wyjątkowym opakowaniem. 4 nowe postaci do zebrania:  Chloe Pepper, Marilyn Star, Emma Emo i Nia Regal W opakowaniu 15 niespodzianek Opakowaniem można się bawić Pudełko z okienkiem  ;500;https://img.smyk.com/https://beta-cdn.smyk.com/media/product/390/1/lol-surprise-tweens-nia-regal-lalka-modowa-7295592.jpg
1;Barbie, Cutie Reveal, Zimowa kraina, lalka jelonek, 1 szt.;Lalki/Lalki celebrytki;139.99;114.74590163934428;Rozpakowywanie lalek Barbie Cutie Reveal z serii Zimowa Kraina to świetna zabawa dzięki 10 niespodziankom, w tym lalce Barbie z punktami zgięcia! Odkrywaj miękkie zimowe zwierzątka i ubranka, niespodzianki oraz transformacje ze zmianą koloru. W opakowaniu znajdziesz lalkę Barbie w kostiumie mięciutkiego zwierzątka. Do wyboru masz jelonka, sowę śnieżną, pieska husky i niedźwiadka polarnego. Odkryj wygląd lalki! Zdejmij kostium, aby odkryć lalkę Barbie z punktami zgięcia, długimi kolorowymi włosami i lśniącymi detalami. Otwórz 4 torebki-niespodzianki, aby znaleźć ubranko i akcesoria:  uroczą spódniczkę, parę zimowych bucików, gąbkę-grzebień, opaskę na głowę inspirowaną zwierzątkiem i specjalnie dobrane minizwierzątko! Przebieraj lalkę Barbie i dobieraj akcesoria - po przekręceniu na drugą stronę góra kostiumu staje się kurtką z niezwykle miękkiego materiału z uroczym nadrukiem np. w kropki lub gwiazdki. Dodatkowo głowa kostiumu zmienia się w legowisko dla minizwierzątka! Lalka nie stoi samodzielnie. Kolory i elementy dekoracyjne mogą się różnić.  ;500;https://img.smyk.com/https://beta-cdn.smyk.com/media/product/390/1/barbie-cutie-reveal-zimowa-kraina-lalka-jelonek-1-szt-7276349.jpg
1;Rainbow High, Cheer Doll, Jade Hunter, lalka modowa;Lalki/Lalki celebrytki;79.99;65.5655737704918;Legenda głosi, że na końcu tęczy znajduje się garnek złota. Ale prawda jest taka, że to coś jeszcze bardziej niesamowitego. Tylko nieliczni, którzy znają się na modzie, mogą podążać za tęczą do Rainbow High, kolorowej szkoły mody, w której każdy uczy się pokazywać swoje prawdziwe kolory. Przedstawiamy Jade Hunter w zupełnie innym stylu! Jest teraz cheerleaderką i dopinguje drużynę swojej szkoły! Jej kolor to zielony! Laleczka ma wspaniałe rysy twarzy, długie rzęsy i piękne włosy, które można rozczesać. Jest w pełni ruchoma, jej ramiona i nogi zginają się, więc może przybrać mnóstwo efektownych poz. Jej stylizację dopełnia kucyk z uroczą kokardką i spinką. Jade ma również pompony, więc może stylowo dopingować drużynę Rainbow High! Zestaw zawiera:  modną lalkę Jade Hunter w stroju cheerleaderk, 1 parę butów, skarpetki, pompony, grzebień do włosów. Rada:  Podczas pierwszego rozpakowywania lalki dokładnie umyj jej włosy, aby usunąć żel do stylizacji i pozwól włosom całkowicie wyschnąć. Następnie jej włosy są gotowe do wyszczotkowania. Zbierz kolekcję pięknych lalek z Rainbow High! Wysokość lalki:  ok. 28 cm.  ;500;https://img.smyk.com/https://beta-cdn.smyk.com/media/product/390/1/rainbow-high-cheer-doll-jade-hunter-lalka-modowa-6867765.jpg
1;Barbie, Dreamtopia, syrenka ze światełkami, lalka;Lalki/Lalki celebrytki;109.99;90.15573770491802;Lalka syrenka z kolekcji Barbie Dreamtopia  niezwykły wygląd i migoczące światełka zanurz syrenkę w wodzie i zachwyć się podświetlanym ogonem naciśnij gorset lalki, aby zobaczyć światełka również bez zanurzania w wodzie lalka ma tęczową płetwę, gorset z perełkami, różowe pasemka we włosach i tiarę księżniczki baterie AG13 w zestawie Wiek:  od 3 lat  ;500;https://img.smyk.com/https://beta-cdn.smyk.com/media/product/390/1/barbie-dreamtopia-syrenka-ze-swiatelkami-lalka-7102350.jpg
1;Barbie Fashionistas, Modna przyjaciółka, lalka nr 178;Lalki/Lalki celebrytki;27.99;22.942622950819672;Barbie i Ken celebrują różnorodność z lalkami Fashionistas, które zachęcają dzieci do tworzenia opowieści osadzonych w prawdziwym świecie oraz podążania za marzeniami.  Niezwykła linia lalek Barbie Fashionistas prezentuje różne typy sylwetki oraz zróżnicowane połączenia odcieni skóry, fryzur, kolorów oczu i włosów, a także mnóstwo ubranek inspirowanych najnowszymi trendami! Każda lalka Barbie ma na sobie wyjątkowy strój, który pasuje do jej stylu. Stylizację dopełniają modne akcesoria, takie jak para bucików czy bransoletka. Różnorodność lalek wyraża się też poprzez ich fryzury o rożnych kolorach, typach włosów i stylach. Winylowe opakowanie wielokrotnego użytku z suwakiem może posłużyć do przechowywania lalki lub ubranek i akcesoriów Barbie. Można je też dowolnie ozdobić, np. za pomocą naklejek. Opakowanie możesz wykorzystać na wiele sposobów - spakuj w nie zabawki, noś ze sobą i personalizuj. To doskonały prezent dla dzieci od 3 roku życia, który pozwoli im opowiadać własne historyjki i odkrywać niezwykły świat Barbie. Większa różnorodność sprawia, że kolekcjonowanie lalek Barbie Fashionistas daje jeszcze więcej radości. Zbierz je wszystkie, aby poszerzyć możliwości zabawy (sprzedawane oddzielnie, zależnie od dostępności). Informacje dodatkowe:  Lalki są sprzedawane oddzielnie i w zależności od dostępności. Lalki nie stoją samodzielnie. Płaskie buciki pasują na lalki z ruchomymi kostkami lub płaskimi stopami. Kolory i elementy dekoracyjne mogą się różnić. Wiek dziecka:  od 3 lat  ;500;https://img.smyk.com/https://beta-cdn.smyk.com/media/product/390/1/barbie-fashionistas-modna-przyjaciolka-lalka-178-7193075.jpg
1;Barbie, Baśniowa fryzura, lalka z akcesoriami;Lalki/Lalki celebrytki;89.99;73.76229508196721;Jednorożec czy syrenka? Lalka Barbie Baśniowa fryzura uwielbia magiczną przemianę – ma dwie fantazyjne stylizacje, z których każda zawiera kolorową opaskę z pasemkami włosów, dobraną tematycznie koszulkę i akcesoria.  Transformacja w syrenkę lub jednorożca zajmuje tylko chwilę!  Załóż koszulkę z grafiką jednorożca lub syrenki, a potem pasującą do niej opaskę.  Kolorowe pasemka przyczepione do opaski nadają jeszcze więcej barw włosom Barbie z odcieniami różu i błękitu oraz błyszczącymi kosmykami.  Wymyśl bajkową fryzurę, upinając długie, kolorowe, błyszczące włosy lalki Barbie za pomocą dołączonych do zestawu gumek do włosów i 2 spinek.Wow! Co za efekt!  Dzieci pokochają przemianę lalki Barbie. W zestawie:   lalka Barbie w ubranku,  dwie opaski z pasemkami włosów,  dwie koszulki z nadrukiem,  druga para bucików,  gumki do włosów,  dwie spinki.  szczotka do włosów. Informacje dodatkowe:   Lalka nie stoi samodzielnie.  Kolory i elementy dekoracyjne mogą się różnić.  Wiek dziecka:  od 3 lat.  ;500;https://img.smyk.com/https://beta-cdn.smyk.com/media/product/390/1/barbie-basniowa-fryzura-lalka-z-akcesoriami-6730218.jpg
1;Rainbow High, Core Fashion Doll, Jewel Richie, lalka modowa;Lalki/Lalki celebrytki;129.99;106.54918032786888;Przedstawiamy Rainbow High CORE Fashion Doll! Tęcza to nieograniczone możliwości kolorystyczne! Wśród nowych uczniów jest 5 fantastycznych dziewczyn i 1 łamacz serc. Wszystkie lalki mają unikalny styl, który widać w dwóch różnych<br>strojach i wielu modnych akcesoriach! A kiedy ustawi się je razem, tworzą oszałamiającą tęczę. Zbierz je wszystkie, żeby zobaczyć te niesamowite kolory tęczy! Cechy produktów:  6 nowych lalek w odcieniach tęczy Lalki zginają się w przegubach Długie włosy do czesania plus akcesoria do włosów i grzebień Dodatkowa odzież dla lalek (2 komplety) + wieszaki Akcesoria modowe (kolczyki, torebka, buty…) Stojak na lalkę Dostępne w 6 nowych kolorach Rada:  Podczas pierwszego rozpakowywania lalki dokładnie umyj jej włosy, aby usunąć żel do stylizacji i pozwól włosom całkowicie wyschnąć. Następnie jej włosy są gotowe do wyszczotkowania. Zbierz kolekcję pięknych lalek z Rainbow High! Wysokość lalki:  ok. 28 cm.  ;500;https://img.smyk.com/https://beta-cdn.smyk.com/media/product/390/1/rainbow-high-core-fashion-doll-jewel-richie-lalka-modowa-7232600.png
1;Barbie Dreamtopia, Księżniczka, Zakręcone Pasemka, lalka;Lalki/Lalki celebrytki;77.99;63.92622950819672;Mali styliści mogą tworzyć swoje wymarzone stylizacje dzięki lalce księżniczce Barbie Dreamtopia Zakręcone pasemka Lalka księżniczka Barbie ma bardzo długie włosy ok. 21 cm. Rozczesz włosy Barbie, a potem umieść dwa lub trzy zaczepy w specjalnym przyrządzie do stylizacji i twórz fantastyczne fryzury jednym naciśnięciem przycisku. Uzupełnij wygląd księżniczki Barbie kolorowymi spinkami i tiarą, a potem ruszaj ku magicznym przygodom. Lalka nie stoi samodzielnie. Kolory i elementy dekoracyjne mogą się różnić. Lalka księżniczka Barbie Dreamtopia Zakręcone pasemka daje tak wiele możliwości tworzenia opowieści i stylizacji, że stanowi wspaniały prezent dla miłośników baśni w wieku 3 lat i starszych.  ;500;https://img.smyk.com/https://beta-cdn.smyk.com/media/product/390/1/barbie-dreamtopia-ksiezniczka-zakrecone-pasemka-lalka-7013917.jpg
1;Rainbow Vision, Rainbow High, Sabrina St. Cloud, lalka modowa;Lalki/Lalki celebrytki;299.99;245.89344262295083;Najlepsze z najlepszych szkół artystycznych z całego świata biorą udział w elitarnym wydarzeniu. Setki kandydatów pokażą swój prawdziwy talent! 3 nowe lalki do przebierania z nowym motywem Piękna, w pełni przegubowa lalka do przebierania Długie włosy do czesania plus akcesoria do włosów i grzebień W zestawie:  lalka Sabrina 2 stroje stylistki akcesoria modowe (kolczyki, buty…) akcesoria pasujące do motywu stojak na lalkę  ;500;https://img.smyk.com/https://beta-cdn.smyk.com/media/product/390/1/rainbow-vision-rainbow-high-sabrina-st-cloud-lalka-modowa-7297478.jpg
1;Rainbow High, Core Fashion Doll, Lila Tamamoto, lalka modowa;Lalki/Lalki celebrytki;139.99;114.74590163934428;Przedstawiamy Rainbow High CORE Fashion Doll! Tęcza to nieograniczone możliwości kolorystyczne! Wśród nowych uczniów jest 5 fantastycznych dziewczyn i 1 łamacz serc. Wszystkie lalki mają unikalny styl, który widać w dwóch różnych<br>strojach i wielu modnych akcesoriach! A kiedy ustawi się je razem, tworzą oszałamiającą tęczę. Zbierz je wszystkie, żeby zobaczyć te niesamowite kolory tęczy! Cechy produktów:  6 nowych lalek w odcieniach tęczy Lalki zginają się w przegubach Długie włosy do czesania plus akcesoria do włosów i grzebień Dodatkowa odzież dla lalek (2 komplety) + wieszaki Akcesoria modowe (kolczyki, torebka, buty…) Stojak na lalkę Dostępne w 6 nowych kolorach Rada:  Podczas pierwszego rozpakowywania lalki dokładnie umyj jej włosy, aby usunąć żel do stylizacji i pozwól włosom całkowicie wyschnąć. Następnie jej włosy są gotowe do wyszczotkowania. Zbierz kolekcję pięknych lalek z Rainbow High! Wysokość lalki:  ok. 28 cm.  ;500;https://img.smyk.com/https://beta-cdn.smyk.com/media/product/390/1/rainbow-high-core-fashion-doll-lila-tamamoto-lalka-modowa-7232599.png
1;Barbie, Koniki, Stylizacja i opieka, zestaw z lalką i akcesoriami;Lalki/Lalki celebrytki;179.99;147.5327868852459;"Daj się zainspirować do zabawy w opiekę, stylizację i przyjaźń z tym zestawem z lalką Barbie, dwoma konikami i mnóstwem akcesoriów. Zestaw do zabawy Barbie Koniki Stylizacja i opieka obejmuje ogrodzenie z poidłem, prysznicem i stanowiskiem do pielęgnowania koni. Wyszczotkuj grzywy obu koników, a potem użyj zimnej wody, aby odkryć kolorowe pasemka Gdy chcesz wrócić do poprzedniego koloru, wykorzystaj ciepłą wodę - tę transformację możesz powtarzać tyle razy, ile chcesz. Przystrój grzywy doczepianymi pasemkami lub kwiatową koroną, a potem użyj specjalnego przyrządu do stylizacji, aby ozdobić grzywę konia lub włosy lalki uroczymi motylkowymi spinkami. Gdy skończysz stylizację, pomóż Barbie ""karmić"" konie ""marchewkami"" - aby ułatwić to zadanie, koniki mają ruchome głowy. Po przekąsce możesz też zgiąć nogi lalki w kolanach i posadzić ją w siodle, aby pogalopować ku przygodzie. Z lalką Barbie, dwoma konikami i ponad 20 akcesoriami tematycznymi masz nieograniczone możliwości opowiadania historyjek Informacje dodatkowe:  Lalka nie stoi samodzielnie. Kolory i elementy dekoracyjne mogą się różnić. Wiek dziecka:  od 3 lat.  ";500;https://img.smyk.com/https://beta-cdn.smyk.com/media/product/390/1/barbie-koniki-stylizacja-i-opieka-zestaw-z-lalka-i-akcesoriami-6981534.jpg
1;Rainbow High, Vision Shadow High, Uma Van Hoose, lalka modowa;Lalki/Lalki celebrytki;179.99;147.5327868852459;Najlepsze z najlepszych szkół artystycznych z całego świata biorą udział w elitarnym wydarzeniu. Setki kandydatów pokażą swój prawdziwy talent! 3 nowe lalki do przebierania z nowym motywem muzycznym. Lalki ze szkoły Shadow High - zespół Neon Shadow Piękna, w pełni przegubowa lalka do przebierania Długie włosy do czesania plus akcesoria do włosów i grzebień W zestawie:  lalka Uma Van Hoose 2 stroje stylistki w zestawie akcesoria modowe (kolczyki, kapelusz / opaska na głowę, buty…) akcesoria pasujące do motywu stojak na lalkę Zbierz wszystkie 3:  Mara Pinkett, Harley Limestone  ;500;https://img.smyk.com/https://beta-cdn.smyk.com/media/product/390/1/rainbow-high-vision-shadow-high-uma-van-hoose-lalka-modowa-7295594.jpg
1;Rainbow High, Core Fashion Doll, Coco Vanderbalt, lalka modowa;Lalki/Lalki celebrytki;89.99;73.76229508196721;Przedstawiamy Rainbow High CORE Fashion Doll! Tęcza to nieograniczone możliwości kolorystyczne! Wśród nowych uczniów jest 5 fantastycznych dziewczyn i 1 łamacz serc. Wszystkie lalki mają unikalny styl, który widać w dwóch różnych<br>strojach i wielu modnych akcesoriach! A kiedy ustawi się je razem, tworzą oszałamiającą tęczę. Zbierz je wszystkie, żeby zobaczyć te niesamowite kolory tęczy! Cechy produktów:  6 nowych lalek w odcieniach tęczy Lalki zginają się w przegubach Długie włosy do czesania plus akcesoria do włosów i grzebień Dodatkowa odzież dla lalek (2 komplety) + wieszaki Akcesoria modowe (kolczyki, torebka, buty…) Stojak na lalkę Dostępne w 6 nowych kolorach Rada:  Podczas pierwszego rozpakowywania lalki dokładnie umyj jej włosy, aby usunąć żel do stylizacji i pozwól włosom całkowicie wyschnąć. Następnie jej włosy są gotowe do wyszczotkowania. Zbierz kolekcję pięknych lalek z Rainbow High! Wysokość lalki:  ok. 28 cm.  ;500;https://img.smyk.com/https://beta-cdn.smyk.com/media/product/390/1/rainbow-high-core-fashion-doll-coco-vanderbalt-lalka-modowa-7232601.png
1;Rainbow High, Emi Vanda Orchid, lalka modowa;Lalki/Lalki celebrytki;119.99;98.35245901639344;Legenda głosi, że na końcu tęczy znajduje się garnek złota. Ale prawda jest taka, że to coś jeszcze bardziej niesamowitego. Tylko nieliczni, którzy znają się na modzie, mogą podążać za tęczą do Rainbow High, kolorowej szkoły mody, w której każdy uczy się pokazywać swoje prawdziwe kolory. Przedstawiamy Emi Vanada. Jest ubrana na fioletowo od stóp do głów. Ma wspaniałe rysy twarzy, długie rzęsy i piękne włosy, które można rozczesać. Jest w pełni ruchoma, jej ręce i nogi zginają się, więc może przybrać mnóstwo efektownych poz. Emi koncentruje się na sztuce i uwielbia wyrażać siebie poprzez sztukę i modę, wyznacza trendy swoim ciemnym, ostrym wyglądem.  Emi ma 2 kompletne stroje, które można łączyć i dopasowywać, aby uzyskać odważny, oszałamiający wygląd. Ubrana jest w stylową bluzę z kapturem, plisowaną spódnicę i rockowe buty do kolan. Jej drugi strój to koszula z długimi rękawami z nadrukiem graficznym, przycięty sweter, spódnica i szpilki ze sznurowanymi wstążkami. Zestaw zawiera również grzebień do włosów, dwa wieszaki i stojak na lalki. Rada:  Podczas pierwszego rozpakowywania lalki dokładnie umyj jej włosy, aby usunąć żel do stylizacji i pozwól włosom całkowicie wyschnąć. Następnie jej włosy są gotowe do wyszczotkowania. Zbierz kolekcję pięknych lalek z Rainbow High! Wysokość lalki:  ok. 28 cm.  ;500;https://img.smyk.com/https://beta-cdn.smyk.com/media/product/390/1/rainbow-high-emi-vanda-orchid-lalka-modowa-7030596.jpg
1;Barbie, Extra Fancy, lalka w stroju w misie;Lalki/Lalki celebrytki;119.99;98.35245901639344;Przedstawiamy ultramodne lalki Barbie Extra Fancy gotowe na WIELKIE wyjście w olśniewających kreacjach! Lalki Barbie Extra Fancy wyglądają olśniewająco dzięki pięknym strojom z luksusowymi detalami i akcesoriami oraz uroczym zwierzęcym towarzyszom. Ta lalka Barbie ma oryginalną fryzurę - bardzo długie włosy są pokarbowane i częściowo upięte na górze w koczki bantu. Lalka wyraża swój odważny styl wyjątkowym strojem, na który składają się wystrzałowa sukienka z tęczowym nadrukiem w misie i błyszczącymi zielonymi detalami oraz półprzezroczysta peleryna z nadrukiem w misie. Niebieskie buciki na obcasie, różowe skarpetki, metaliczne miniokulary przeciwsłoneczne, fioletowe rękawiczki, oryginalna torebka i mnóstwo biżuterii inspirują do wyrażania swojego stylu i kreatywnej zabawy. Dołączony miś też jest niezwykle modny - ma urocza minkę i własne akcesorium. Lalki Barbie Extra Fancy to świetny prezent dla dzieci w wieku od 3 do 10 lat, zwłaszcza tych, które uwielbiają zadawać szyku.  ;500;https://img.smyk.com/https://beta-cdn.smyk.com/media/product/390/1/barbie-extra-fancy-lalka-w-stroju-w-misie-7271929.jpg
1;Barbie, Kemping, Skipper i zwierzątko, zestaw z lalką i akcesoriami;Lalki/Lalki celebrytki;54.99;45.07377049180328;"Ruszaj ku kempingowej przygodzie z lalkami Skipper i Stacie (sprzedawane oddzielnie) inspirowanymi hitowym serialem Barbie ""It Takes Two - My dwie"". W zestawie z lalką Skipper są króliczek i akcesoria kempingowe, takie jak ""ognisko"", kolba kukurydzy, kubki i garnek. Lalka nosi kolorowe stroje biwakowe, a w zestawie są naklejki, których można używać do personalizacji akcesoriów dla lalek! Dzięki licznym akcesoriom i możliwościom opowiadania historii ten zestaw do zabawy Barbie to wspaniały prezent dla dzieci w wieku od 3 do 7 lat, zwłaszcza dla tych, które uwielbiają wypoczynek na świeżym powietrzu.  ";500;https://img.smyk.com/https://beta-cdn.smyk.com/media/product/390/1/barbie-kemping-skipper-i-zwierzatko-zestaw-z-lalka-i-akcesoriami-7106865.jpg
1;L.O.L. Surprise, Tweens, Emma Emo, lalka modowa;Lalki/Lalki celebrytki;94.99;77.86065573770492;Przedstawiamy L.O.L. Surprise! Tweens! Te charakterne be tweens są dostępne z niespodziankami i wyjątkowym opakowaniem. 4 nowe postaci do zebrania:  Chloe Pepper, Marilyn Star, Emma Emo i Nia Regal W opakowaniu 15 niespodzianek Opakowaniem można się bawić Pudełko z okienkiem  ;500;https://img.smyk.com/https://beta-cdn.smyk.com/media/product/390/1/lol-surprise-tweens-emma-emo-lalka-modowa-7295591.jpg
1;Mermaze Mermaidz, Theme Doll, Gwen, lalka modowa zmieniająca kolor;Lalki/Lalki celebrytki;129.99;106.54918032786888;Na fali, w toni oceanu, głęboko pod wodą… Płyń za bajecznymi płetwami Mermaze, aby odkryć coś niesamowitego! Czy wiesz, że syreny są takie jak my? Uwielbiają odkrywać nowe miejsca i nawiązywać nowe przyjaźnie! Te syrenki mają wyjątkowe ogony wypełnione wodą i brokatem. Mają też nową, fantastyczną funkcję — zmieniają kolor! Ogon zmienia kolor po zanurzeniu w wodzie! Te syrenki mają również wyjątkowe płetwy i przyjemne w dotyku ubrania! Charakterystyka produktów:  Lalki syrenki do przebierania z miłą w dotyku odzieżą, akcesoriami i nowym ogonem, który zmienia kolor 3 nowe postacie i powrót 2 ulubionych postaci Nowy kształt płetwy Ogon jest wypełniony wodą i brokatem dla zapewnienia hipnotyzującego efektu Ogon zmienia kolor po zanurzeniu w wodzie Unikalny, formowany, ozdobny ogon ma przeguby w talii i przy płetwie Przepiękne szklane oczy Długie, kolorowe włosy, które można czesać Zdejmowana kurtka i top Torebka i biżuteria Stojak na lalkę  ;500;https://img.smyk.com/https://beta-cdn.smyk.com/media/product/390/1/mermaze-mermaidz-theme-doll-gwen-lalka-modowa-zmieniajaca-kolor-7331450.jpg
